{
  "id": "all-templates-offline-demo",
  "language": "id-ID",
  "width": 1080,
  "height": 1920,
  "fps": 30,
  "theme": {
    "id": "midnight"
  },
  "scenes": [
    {
      "sceneId": "demo-1",
      "template": "KineticTypography",
      "segment": "Adegan demonstrasi fiksi untuk pengujian lokal.",
      "assetRefs": [],
      "text": [
        {
          "id": "t-0",
          "text": "Cerita bergerak dari ide",
          "style": {
            "role": "title"
          }
        }
      ],
      "animation": {
        "preset": "slideUp",
        "durationInFrames": 20
      },
      "transition": {
        "type": "none",
        "durationInFrames": 0
      },
      "startFrame": 0,
      "durationInFrames": 150,
      "data": {
        "highlightIndex": 2
      }
    },
    {
      "sceneId": "demo-2",
      "template": "EducationalExplainer",
      "segment": "Adegan demonstrasi fiksi untuk pengujian lokal.",
      "assetRefs": [],
      "text": [
        {
          "id": "t-1",
          "text": "Cerita bergerak dari ide",
          "style": {
            "role": "title"
          }
        }
      ],
      "animation": {
        "preset": "slideUp",
        "durationInFrames": 20
      },
      "transition": {
        "type": "none",
        "durationInFrames": 0
      },
      "startFrame": 150,
      "durationInFrames": 150,
      "data": {
        "bullets": [
          "Data adegan tervalidasi",
          "Visual dibuat proyek ini",
          "Tidak memakai media berbayar"
        ]
      }
    },
    {
      "sceneId": "demo-3",
      "template": "MotionComic",
      "segment": "Adegan demonstrasi fiksi untuk pengujian lokal.",
      "assetRefs": [],
      "text": [
        {
          "id": "t-2",
          "text": "Cerita bergerak dari ide",
          "style": {
            "role": "title"
          }
        }
      ],
      "animation": {
        "preset": "slideUp",
        "durationInFrames": 20
      },
      "transition": {
        "type": "none",
        "durationInFrames": 0
      },
      "startFrame": 300,
      "durationInFrames": 150,
      "data": {
        "title": "Satu ide, tiga panel",
        "panels": [
          {
            "speaker": "NARA",
            "caption": "Semuanya berawal dari satu ide."
          },
          {
            "speaker": "NARA",
            "caption": "Lalu kita menyusun langkahnya."
          },
          {
            "caption": "Kisah kecil pun bergerak."
          }
        ]
      }
    },
    {
      "sceneId": "demo-4",
      "template": "HistoricalTimeline",
      "segment": "Adegan demonstrasi fiksi untuk pengujian lokal.",
      "assetRefs": [],
      "text": [
        {
          "id": "t-3",
          "text": "Cerita bergerak dari ide",
          "style": {
            "role": "title"
          }
        }
      ],
      "animation": {
        "preset": "slideUp",
        "durationInFrames": 20
      },
      "transition": {
        "type": "none",
        "durationInFrames": 0
      },
      "startFrame": 450,
      "durationInFrames": 150,
      "data": {
        "title": "Perjalanan sebuah ide",
        "events": [
          {
            "date": "LANGKAH 01",
            "label": "Temukan pertanyaan",
            "detail": "Demo alur kerja, bukan fakta sejarah."
          },
          {
            "date": "LANGKAH 02",
            "label": "Periksa bukti"
          },
          {
            "date": "LANGKAH 03",
            "label": "Bagikan cerita"
          }
        ]
      }
    },
    {
      "sceneId": "demo-5",
      "template": "ParallaxStory",
      "segment": "Adegan demonstrasi fiksi untuk pengujian lokal.",
      "assetRefs": [],
      "text": [
        {
          "id": "t-4",
          "text": "Cerita bergerak dari ide",
          "style": {
            "role": "title"
          }
        }
      ],
      "animation": {
        "preset": "slideUp",
        "durationInFrames": 20
      },
      "transition": {
        "type": "none",
        "durationInFrames": 0
      },
      "startFrame": 600,
      "durationInFrames": 150,
      "data": {
        "title": "Di balik setiap lapisan",
        "caption": "Ilustrasi orisinal proyek · demo fiksi",
        "layers": [
          {
            "shape": "circle",
            "depth": 0.15
          },
          {
            "shape": "ridge",
            "depth": 0.45
          },
          {
            "shape": "city",
            "depth": 0.9
          }
        ]
      }
    },
    {
      "sceneId": "demo-6",
      "template": "InfographicMotion",
      "segment": "Adegan demonstrasi fiksi untuk pengujian lokal.",
      "assetRefs": [],
      "text": [
        {
          "id": "t-5",
          "text": "Cerita bergerak dari ide",
          "style": {
            "role": "title"
          }
        }
      ],
      "animation": {
        "preset": "slideUp",
        "durationInFrames": 20
      },
      "transition": {
        "type": "none",
        "durationInFrames": 0
      },
      "startFrame": 750,
      "durationInFrames": 150,
      "data": {
        "title": "Tiga langkah, satu cerita",
        "items": [
          {
            "label": "Ide uji",
            "value": 3816,
            "unit": "poin"
          },
          {
            "label": "Visual uji",
            "value": 2500,
            "unit": "poin"
          },
          {
            "label": "Cerita uji",
            "value": 1800,
            "unit": "poin"
          }
        ],
        "maxValue": 4000,
        "decimals": 0
      }
    }
  ],
  "subtitles": [],
  "watermark": {
    "text": "DEMO FIKSI · FIXTURE LOKAL"
  }
}